{
  "format" : "slotstream-tokenized-prompt-v1",
  "promptCount" : 68,
  "promptIDs" : [
    248045,
    846,
    198,
    5423,
    26555,
    1132,
    11,
    440,
    874,
    70703,
    66814,
    466,
    29611,
    13,
    561,
    4108,
    1902,
    381,
    307,
    10355,
    4986,
    9809,
    3632,
    13,
    4844,
    7936,
    1396,
    7308,
    307,
    494,
    220,
    16,
    1472,
    220,
    18,
    17,
    303,
    7459,
    1906,
    11,
    799,
    2713,
    791,
    1324,
    11,
    440,
    1141,
    9057,
    321,
    22997,
    13,
    28763,
    660,
    220,
    18,
    17,
    795,
    6761,
    13,
    248046,
    198,
    248045,
    74455,
    198,
    248068,
    271,
    248069,
    271
  ],
  "promptIDsSHA256" : "cafac76a5e4a806970eaf7121038cba6d5b04df0e3cbd75f0aff15e6ceb414b3",
  "schemaVersion" : 1,
  "sourceDocument" : {
    "category" : "long-completion",
    "contentSHA256" : "a230150c112bade705522f09482963eb1f0d521bfc0a8f2a9e79ccaf4a26df8c",
    "id" : "long-csv",
    "kind" : "chat",
    "license" : "MIT",
    "partitionKey" : "long-csv",
    "sourceID" : "Plan019 frozen task from repository docs\/code or deterministic arithmetic",
    "split" : "development"
  }
}