{
  "format" : "slotstream-tokenized-prompt-v1",
  "promptCount" : 41,
  "promptIDs" : [
    248045,
    846,
    198,
    44712,
    220,
    16,
    22,
    478,
    220,
    17,
    24,
    478,
    220,
    20,
    13,
    17308,
    440,
    1132,
    264,
    4566,
    1576,
    440,
    279,
    1328,
    328,
    1200,
    1,
    321,
    1141,
    7308,
    869,
    13,
    248046,
    198,
    248045,
    74455,
    198,
    248068,
    271,
    248069,
    271
  ],
  "promptIDsSHA256" : "35e6e89ae0d05ec5735f93f5b8d805f6225c4e093ffdeaa1197e3283ce09f4e6",
  "schemaVersion" : 1,
  "sourceDocument" : {
    "category" : "short",
    "contentSHA256" : "9d79c42345179b33f9bcb255eadb70438a6cb178d813b5e3b78223eb09ee5ce9",
    "id" : "short-json",
    "kind" : "chat",
    "license" : "MIT",
    "partitionKey" : "short-json",
    "sourceID" : "Plan019 frozen task from repository docs\/code or deterministic arithmetic",
    "split" : "development"
  }
}